{
  "schema_version": "1.0",
  "evidence_id": "55555555-5555-4555-8555-555555555555",
  "run_id": "11111111-1111-4111-8111-111111111111",
  "stage": "test",
  "requirement_ids": ["NFR-004"],
  "type": "file",
  "description": "Synthetic output was inspected.",
  "procedure": ["Read the synthetic output."],
  "outcome": "passed",
  "artifact_refs": [{"kind": "file", "ref": "artifacts/result.txt"}],
  "digest": "cccccccccccccccccccccccccccccccccccccccccccccccccccccccccccccccc",
  "actor": {"harness": "codex", "actor": "synthetic-agent", "session_id": "session-1"},
  "observed_at": "2026-08-16T08:10:00Z",
  "environment": {"platform": "synthetic"}
}
